{
  "schema_version": "turnvector.benchmark.expectation.v3",
  "id": "turnvector-implementation-v2",
  "description": "Normative benchmark expectations derived from the TurnVector implementation contract; harness availability never removes required coverage.",
  "source_contract": {
    "repository": "TurnVector",
    "revision": "eedad5faf881da329844463eeaf54d9970350abd",
    "clean_required": true
  },
  "authority": {
    "source_reconciliation_path": "authority/source-reconciliation-v1.json",
    "source_reconciliation_sha256": "13706cdd46416d394fe3b8c9ce47203c7b77367199be31f502eb3b7122db7a1c"
  },
  "certification_policy": {
    "required_lane_policy": "all_required_lanes_must_execute_and_pass",
    "unsupported_policy": "required_lane_failure",
    "scope_policy": "claims_are_limited_to_exact_evidence_identity"
  },
  "lanes": [
    {
      "id": "core-event-replay",
      "layer": "runtime-core",
      "description": "Deterministic Runtime Core state transitions, effect ordering, fault handling, and replay.",
      "required": true,
      "implementation_sources": [
        "CONTEXT.md",
        "docs/adr/0005-run-pure-scheduling-and-backend-execution-in-one-device-loop.md",
        "docs/adr/0016-distinguish-plan-rejection-from-started-turn-outcomes.md",
        "docs/adr/0032-separate-the-pure-core-from-protocol-and-io.md",
        "docs/adr/0033-commit-core-transitions-atomically-and-fail-closed.md"
      ],
      "harness": {
        "protocol": "turnvector.benchmark.core-replay.v1",
        "runner": "core-event-replay",
        "suite": "../suites/lanes/core-event-replay-v1.json"
      },
      "matrices": [
        {
          "id": "effect-result-replay",
          "dimensions": [
            {
              "id": "result",
              "values": ["completed", "failed", "cancelled", "indeterminate"]
            },
            {
              "id": "sequence_relation",
              "values": ["current", "duplicate", "late", "unknown", "stale_generation"]
            }
          ]
        }
      ],
      "cases": [
        {
          "id": "deterministic-state",
          "requirement": "Identical ordered Core Events produce identical outcomes, effects, invariant results, and state hashes."
        },
        {
          "id": "atomic-failure",
          "requirement": "Sequence or invariant failure preserves the prior state and exposes no effect."
        },
        {
          "id": "effect-idempotence",
          "requirement": "Duplicate, late, unknown, and generation-mismatched Effect Results never reapply state."
        },
        {
          "id": "cancellation-order",
          "requirement": "Event Sequence alone resolves cancellation before or after Receipt commit and output publication."
        }
      ],
      "gates": [
        {
          "id": "replay-hash",
          "metric": "replay_hash_mismatch_count",
          "operator": "eq",
          "expected": 0,
          "unit": "count",
          "threshold_source": "benchmark_contract",
          "evidence": ["event_trace", "state_hashes"]
        },
        {
          "id": "invariant-safety",
          "metric": "committed_invariant_violation_count",
          "operator": "eq",
          "expected": 0,
          "unit": "count",
          "threshold_source": "benchmark_contract",
          "evidence": ["event_trace", "invariant_results"]
        },
        {
          "id": "failed-transition-effects",
          "metric": "effects_exposed_after_failed_transition_count",
          "operator": "eq",
          "expected": 0,
          "unit": "count",
          "threshold_source": "benchmark_contract",
          "evidence": ["effect_trace"]
        }
      ],
      "required_artifacts": ["manifest", "event_trace", "state_hashes", "invariant_results", "report"],
      "claim_scope": ["runtime_core_conformance"]
    },
    {
      "id": "scheduler-policy",
      "layer": "runtime-core",
      "description": "Safety-first urgency and runnable-only weighted Engine Service selection.",
      "required": true,
      "implementation_sources": [
        "CONTEXT.md",
        "docs/adr/0003-use-runnable-only-weighted-engine-service-fairness.md",
        "docs/adr/0004-apply-resource-safety-before-urgency-and-fairness.md",
        "docs/adr/0007-support-open-work-kinds-through-fixed-scheduling-semantics.md",
        "docs/adr/0010-use-three-phase-aware-service-classes.md",
        "docs/adr/0015-use-deterministic-deadline-aware-weighted-service-selection.md"
      ],
      "harness": {
        "protocol": "turnvector.benchmark.scheduler-policy.v1",
        "runner": "scheduler-policy",
        "suite": "../suites/lanes/scheduler-policy-v1.json",
        "legacy_protocol": "turnvector.benchmark.driver.v1",
        "legacy_suite": "../suites/scheduler-policy-v1.json"
      },
      "matrices": [
        {
          "id": "scheduler-scenarios",
          "dimensions": [
            {
              "id": "scenario",
              "values": ["weighted_service", "idle_reentry", "urgency_after_safety"]
            }
          ]
        }
      ],
      "cases": [
        {
          "id": "weighted-service",
          "requirement": "Continuously runnable Models receive Engine Service in exact proportion to Model Weight."
        },
        {
          "id": "idle-reentry",
          "requirement": "A returning Model aligns to the runnable baseline and receives no stored credit."
        },
        {
          "id": "safety-before-urgency",
          "requirement": "Unsafe candidates are removed before Latest Safe Start and ledger selection."
        }
      ],
      "gates": [
        {
          "id": "oracle-selection",
          "metric": "oracle_selection_mismatch_count",
          "operator": "eq",
          "expected": 0,
          "unit": "count",
          "threshold_source": "benchmark_contract",
          "evidence": ["trace", "report"]
        },
        {
          "id": "receipt-accounting",
          "metric": "receipt_ledger_mismatch_count",
          "operator": "eq",
          "expected": 0,
          "unit": "count",
          "threshold_source": "benchmark_contract",
          "evidence": ["trace", "report"]
        },
        {
          "id": "deterministic-replay",
          "metric": "plan_trace_hash_mismatch_count",
          "operator": "eq",
          "expected": 0,
          "unit": "count",
          "threshold_source": "benchmark_contract",
          "evidence": ["trace", "report"]
        }
      ],
      "required_artifacts": ["manifest", "environment", "trace", "report", "checksums"],
      "claim_scope": ["scheduler_policy_conformance"]
    },
    {
      "id": "scheduler-performance",
      "layer": "runtime-core",
      "description": "Release-mode pure-Core scheduling latency and throughput measured independently from adapter IPC.",
      "required": true,
      "implementation_sources": [
        "CONTEXT.md",
        "docs/adr/0005-run-pure-scheduling-and-backend-execution-in-one-device-loop.md",
        "docs/adr/0007-support-open-work-kinds-through-fixed-scheduling-semantics.md",
        "docs/adr/0015-use-deterministic-deadline-aware-weighted-service-selection.md",
        "docs/adr/0032-separate-the-pure-core-from-protocol-and-io.md"
      ],
      "harness": {
        "protocol": "turnvector.benchmark.scheduler-performance.v1",
        "runner": "scheduler-performance",
        "suite": "../suites/lanes/scheduler-performance-v1.json"
      },
      "matrices": [
        {
          "id": "decision-shape",
          "dimensions": [
            {
              "id": "runnable_models",
              "values": [1, 2, 8, 32, 128]
            },
            {
              "id": "urgency_mix",
              "values": ["none", "mixed"]
            },
            {
              "id": "resource_mode",
              "values": ["normal", "guarded", "stop_admission", "critical"]
            }
          ]
        }
      ],
      "cases": [
        {
          "id": "release-core-only",
          "requirement": "Decision timing uses a release-mode in-process Core adapter and excludes process startup, serialization, and driver IPC."
        },
        {
          "id": "shape-scaling",
          "requirement": "Fixed Snapshot sizes exercise feasible, urgent, and safety-filtered candidate sets without changing the expected Plan."
        },
        {
          "id": "distribution-retention",
          "requirement": "Warmup policy, every measured sample, failures, and p50/p95/p99 distributions are preserved."
        }
      ],
      "gates": [
        {
          "id": "oracle-equivalence",
          "metric": "performance_plan_mismatch_count",
          "operator": "eq",
          "expected": 0,
          "unit": "count",
          "threshold_source": "benchmark_contract",
          "evidence": ["plan_trace", "oracle_trace"]
        },
        {
          "id": "decision-latency",
          "metric": "decision_latency_p99_us",
          "operator": "lte",
          "expected": "certification_record.decision_latency_p99_us",
          "unit": "microseconds",
          "threshold_source": "certification_record",
          "evidence": ["latency_samples", "environment"]
        },
        {
          "id": "decision-throughput",
          "metric": "decisions_per_second",
          "operator": "gte",
          "expected": "certification_record.decisions_per_second",
          "unit": "count",
          "threshold_source": "certification_record",
          "evidence": ["latency_samples", "environment"]
        },
        {
          "id": "measurement-boundary",
          "metric": "driver_ipc_included",
          "operator": "eq",
          "expected": false,
          "unit": "boolean",
          "threshold_source": "run_manifest",
          "evidence": ["manifest", "measurement_trace"]
        }
      ],